{
  "$schema": "https://json-schema.org/draft/2020-12/schema",
  "$id": "https://github.com/ddrscott/bulletin-mail/blob/main/packages/shared/instance.config.schema.json",
  "title": "InstanceConfig",
  "description": "Per-deployment configuration for a BulletinMail instance. See PRD §20.",
  "type": "object",
  "required": [
    "apexDomain",
    "productName",
    "productNameShort",
    "tagline",
    "archiveUrlTemplate",
    "unsubscribeUrlTemplate",
    "operator"
  ],
  "additionalProperties": false,
  "properties": {
    "$schema": { "type": "string" },

    "apexDomain": {
      "type": "string",
      "pattern": "^[a-z0-9.-]+\\.[a-z]{2,}$",
      "description": "Root domain serving the instance, e.g. 'lists.example.org'."
    },
    "productName": { "type": "string", "minLength": 1 },
    "productNameShort": { "type": "string", "minLength": 1 },
    "tagline": { "type": "string" },

    "supportAddress": { "type": "string", "default": "support" },
    "abuseAddress": { "type": "string", "default": "abuse" },
    "dmarcAddress": { "type": "string", "default": "dmarc" },
    "noreplyAddress": { "type": "string", "default": "noreply" },
    "unsubscribeAddressPrefix": {
      "type": "string",
      "default": "unsubscribe+",
      "description": "Local-part prefix for one-click unsubscribe tokens, e.g. 'unsubscribe+'."
    },
    "mailSubdomain": {
      "type": ["string", "null"],
      "default": null,
      "description": "Optional DNS label to host outbound + inbound mail on. When set, system addresses (noreply, support, abuse, dmarc) and the unsubscribe mailto live at <mailSubdomain>.<apex> instead of <apex>. In single-tenant deployments this is the recommended pattern (default 'mail') — the apex serves the wiki/admin web UI, and mail lives on its own subdomain with its own SPF/DKIM/DMARC. The lone tenant's slug equals mailSubdomain in single-tenant mode, so list addresses become <group>@<mailSubdomain>.<apex>. In multi-tenant mode this only affects system addresses; list addresses still use <group>@<tenant>.<apex>."
    },

    "archiveUrlTemplate": {
      "type": "string",
      "description": "URL template; supports {tenant}, {group}, {apex}."
    },
    "unsubscribeUrlTemplate": {
      "type": "string",
      "description": "URL template; supports {token}, {apex}."
    },

    "additionalReservedSlugs": {
      "type": "array",
      "items": { "type": "string" },
      "default": []
    },
    "minSlugLength": { "type": "integer", "minimum": 1, "default": 3 },
    "maxSlugLength": { "type": "integer", "minimum": 1, "default": 40 },

    "defaultDailyMessageLimitPerTenant": {
      "type": "integer",
      "minimum": 1,
      "default": 1000
    },
    "defaultMaxRecipientsPerGroup": {
      "type": "integer",
      "minimum": 1,
      "default": 500
    },

    "operator": {
      "type": "object",
      "required": ["legalName", "mailingAddress", "contactUrl"],
      "additionalProperties": false,
      "properties": {
        "legalName": { "type": "string" },
        "mailingAddress": { "type": "string", "description": "Required for CAN-SPAM compliance." },
        "contactUrl": { "type": "string", "format": "uri" }
      }
    },

    "ai": {
      "type": "object",
      "additionalProperties": false,
      "description": "Workers AI tuning for the features.ai.* flags. Only consulted when at least one flag is on and the web Worker has the AI binding.",
      "properties": {
        "dailyGenerationCap": {
          "type": "integer",
          "minimum": 1,
          "default": 20,
          "description": "Max AI generation calls (text or image) per tenant per UTC day. Counted in D1 (ai_usage table); once hit, generation refuses with a clear 'limit reached' message until the next UTC day."
        },
        "textModel": {
          "type": "string",
          "default": "@cf/meta/llama-3.3-70b-instruct-fp8-fast",
          "description": "Workers AI text-generation model id used by promote-to-wiki and red-link autogen. Configurable so operators can track Workers AI model deprecations without a source change."
        },
        "imageModel": {
          "type": "string",
          "default": "@cf/black-forest-labs/flux-1-schnell",
          "description": "Workers AI text-to-image model id used for wiki hero images."
        }
      }
    },

    "features": {
      "type": "object",
      "additionalProperties": false,
      "properties": {
        "byoDomainEnabled": { "type": "boolean", "default": false },
        "publicArchivesAllowed": { "type": "boolean", "default": true },
        "signupSelfService": { "type": "boolean", "default": false },
        "singleTenant": {
          "type": "boolean",
          "default": false,
          "description": "When true, the apex domain IS the tenant (no <slug>.<apex> subdomains). The wiki, /admin/, /join/, /auth/ all serve from the apex root. The single tenant is identified by the fixed slug 'main'. First admin signup atomically creates the tenant row + admin. The marketing landing page and Astro docs are skipped. Set this in the deployments/<apex>/instance.config.json overlay for single-org deployments."
        },
        "searchEnabled": {
          "type": "boolean",
          "default": false,
          "description": "Unified search over the mail archive + wiki via Cloudflare Vectorize + Workers AI embeddings. When true, render-wrangler keeps the Vectorize binding blocks in the web + inbound Workers (the operator must first create the index: wrangler vectorize create bulletinmail-search --dimensions=768 --metric=cosine, plus a tenant_id string metadata index). When false (default) the binding blocks are stripped, the /search UI hides, and all indexing hooks no-op. The weekly digest works either way — it has no AI/Vectorize dependency."
        },
        "ai": {
          "type": "object",
          "additionalProperties": false,
          "description": "LLM extras, each independently opt-in and default OFF. These are the only features that can meaningfully consume paid resources, so they ship dark. A flag alone is not enough — the web Worker must also have the Workers AI binding; when absent the features hide entirely. Zero Workers AI calls when off. See docs/how-to/ai-features.md for enabling and honest cost notes.",
          "properties": {
            "promoteToWiki": {
              "type": "boolean",
              "default": false,
              "description": "Admins/moderators can promote an archive thread into an LLM-drafted wiki page. The draft opens in the editor for human review — never auto-published."
            },
            "wikiAutogen": {
              "type": "boolean",
              "default": false,
              "description": "Following a red link to a missing wiki page offers signed-in editors a 'Generate draft with AI' action that writes a first draft in the wiki's voice, seeding [[links]] to existing pages."
            },
            "wikiHeroImages": {
              "type": "boolean",
              "default": false,
              "description": "AI-generated hero images for wiki pages, stored in the wiki R2 bucket and served from /wiki/img/."
            }
          }
        }
      }
    }
  }
}
