{
  "$schema": "./packages/shared/instance.config.schema.json",

  "apexDomain": "example.org",
  "productName": "Example Lists",
  "productNameShort": "Lists",
  "tagline": "Mailing lists for our organization",

  "supportAddress": "support",
  "abuseAddress": "abuse",
  "dmarcAddress": "dmarc",
  "noreplyAddress": "noreply",
  "unsubscribeAddressPrefix": "unsubscribe+",

  "archiveUrlTemplate": "https://example.org/g/{tenant}/{group}",
  "unsubscribeUrlTemplate": "https://example.org/u/{token}",

  "additionalReservedSlugs": [],
  "minSlugLength": 3,
  "maxSlugLength": 40,

  "defaultDailyMessageLimitPerTenant": 1000,
  "defaultMaxRecipientsPerGroup": 500,

  "operator": {
    "legalName": "REPLACE: legal name of the entity operating this instance",
    "mailingAddress": "REPLACE: street address (required for CAN-SPAM footer in outbound mail)",
    "contactUrl": "REPLACE: https://<your-apex>/contact"
  },

  "features": {
    "byoDomainEnabled": false,
    "publicArchivesAllowed": true,
    "signupSelfService": false,
    "singleTenant": false
  }
}
